<!ELEMENT biblioteca (libro)+>
<!ELEMENT libro (titulo,autores,anio)>
<!ELEMENT titulo (#PCDATA)>
<!ELEMENT autores (autor+)>
<!ELEMENT autor (nombre, apellido, nacionalidad)>
<!ELEMENT nombre (#PCDATA)>
<!ELEMENT apellido (#PCDATA)>
<!ELEMENT nacionalidad (#PCDATA)>
<!ELEMENT anio (#PCDATA)>
<!ATTLIST libro idlibro ID #REQUIRED>
<!ATTLIST libro genero CDATA #IMPLIED>
<!ATTLIST libro idioma CDATA "EspaÃ±ol">
<!ATTLIST libro formato (impreso|digital) "impreso">
<!ATTLIST libro ref IDREFS #IMPLIED>
