<?xml version="1.0" encoding="UTF-8"?>
<!DOCTYPE biblioteca SYSTEM '02.dtd'>
<biblioteca>
    <libro idlibro="libro1" genero="novela" ref="libro2">
        <titulo>
        puntos para los locos
        </titulo>
        <autores>
            <autor>
                <nombre>Angel </nombre>
                <apellido>Martín</apellido>
                <nacionalidad>Español</nacionalidad>
            </autor>
        </autores>
        <anio>2024</anio>
    </libro>
    <libro idlibro="libro2" genero="novela">
        <titulo>
        Por si las voces vuelven
        </titulo>
        <autores>
            <autor>
                <nombre>Angel </nombre>
                <apellido>Martín</apellido>
                <nacionalidad>Español</nacionalidad>
            </autor>
        </autores>
        <anio>2020</anio>
    </libro>
</biblioteca>